Customer Query,Intent,,,,,,,
How much baggage am I allowed to carry?,Baggage,,,,,,,
What if I exceed my free baggage weight allowance?,Baggage,,,,,,,
What items are not permitted on flight?,Baggage,,,,,,,
What items are considered as special baggage and how can I carry them?,Baggage,,,,,,,
How much luggage is allowed on flights?,Baggage,,,,,,,
I am travelling in Business Class; what is the maximum weight allowed for my checked bag?,Baggage,,,,,,,
My baggage weighs 25kg (55lb). Is it possible to pay for two extra kilos?,Baggage,,,,,,,
Does my baggage allowance change when I upgrade my travel class?,Baggage,,,,,,,
My ticket class is “Economy”. What’s my baggage allowance?,Baggage,,,,,,,
My ticket type is Light. I am travelling with one checked bag and one weapon case. How many additional pieces of baggage do I need to purchase?,Baggage,,,,,,,
What is my checked/hold baggage allowance?,Baggage,,,,,,,
Can I  carry 12kg of carry-on baggage?,Baggage,,,,,,,
Will my carry-on baggage be measured?,Baggage,,,,,,,
Can I take more carry-on baggage if I pay an extra fee?,Baggage,,,,,,,
What are the baggage allowances for infants and children?,Baggage,,,,,,,
Can I take a folding pushchair into the cabin?,Baggage,,,,,,,
What can I take in my carry-on baggage?,Baggage,,,,,,,
Can I carry a razor in my carry-on baggage?,Baggage,,,,,,,
Can I take an umbrella (not foldable) to the cabin?,Baggage,,,,,,,
What is a heavy bag?,Baggage,,,,,,,
How can I pay for extra baggage if one of the flights in my itinerary is not operated by Finnair?,Baggage,,,,,,,
What should I do if my baggage is lost or damaged?,Baggage,,,,,,,
Can I transport a computer or a television screen as checked baggage?,Baggage,,,,,,,
Does my baggage go straight to destination?,Baggage,,,,,,,
Why can’t I pay for the extra baggage in advance?,Baggage,,,,,,,
I paid for extra baggage. Why does my ticket still show the original allowance?,Baggage,,,,,,,
"If I'm travelling on an Economy Lite fare with another passenger and carrying 1 bag of 20kg, will I have to pay any extra baggage charges?",Baggage,,,,,,,
How much Hand Baggage can I carry on my Vistara flight?,Baggage,,,,,,,
How much will I be charged in case of an oversized item?,Baggage,,,,,,,
What is the check-in baggage allowance?,Baggage,,,,,,,
What is the hand baggage allowance?,Baggage,,,,,,,
"What is the maximum weight of one bag in Economy, Premium Economy and Business?",Baggage,,,,,,,
Are there any items I cannot carry on board a Vistara flight?,Baggage,,,,,,,
Can I carry medicines on board a Vistara flight?,Baggage,,,,,,,
What items are not allowed in baggage?,Baggage,,,,,,,
What is the size of Hand baggage?,Baggage,,,,,,,
"I am travelling with an infant, will I get additional baggage allowance?",Baggage,,,,,,,
What extra items are allowed in the cabin in addition to the hand baggage?,Baggage,,,,,,,
Can I pre-purchase Excess baggage if I am travelling on an Interline/Codeshare ticket?,Baggage,,,,,,,
Where can I collect my oversize baggage from?,Baggage,,,,,,,
What are the charges for Oversize baggage?,Baggage,,,,,,,
Which items are allowed in the luggage?,Baggage,,,,,,,
Which items are restricted in luggage,Baggage,,,,,,,
Items allowed in carry on bags,Baggage,,,,,,,
Can I take a knife with me?,Baggage,,,,,,,
How do I book car parking online?,Parking,,,,,,,
How close to my date/time of travel can I pre-book car parking online?,Parking,,,,,,,
Can pre-booked customers arrive before the pre-booked arrival time?,Parking,,,,,,,
What methods of payment can I use to pre-book parking online?,Parking,,,,,,,
"I haven’t pre-booked online, can I still use the car park facilities?",Parking,,,,,,,
How do I know if my car park booking has been accepted?,Parking,,,,,,,
How far in advance can I pre-book car parking?,Parking,,,,,,,
What is the normal charge for parking in the Short Term car park when I don't book online?,Parking,,,,,,,
Is it possible to amend or cancel a car park booking?,Parking,,,,,,,
Do I get a refund if I cancel my car park online booking?,Parking,,,,,,,
Do I have to pay a fee to amend or cancel my booking?,Parking,,,,,,,
How do I extend my booking?,Parking,,,,,,,
"I have booked the wrong Terminal car park and want to change it, is this possible?",Parking,,,,,,,
I prebooked a specific terminal; can I park in another terminal?,Parking,,,,,,,
Can I make changes to the prepaid parking reservation?,Parking,,,,,,,
Can I drive a vehicle different from the reservation?,Parking,,,,,,,
How much is parking at RGI airport per day?,Parking,,,,,,,
Does RGIA have a valet parking facility?,Parking,,,,,,,
How do I amend my booking?,Parking,,,,,,,
 How do I book parking online? ,Parking,,,,,,,
Can I pre-book parking?,Parking,,,,,,,
How does Prepaid Parking Online work?  How do I book parking online?,Parking,,,,,,,
Is there a grace period when prepaying to park?,Parking,,,,,,,
 I prepaid online; do I have to specify what Terminal I am flying out of? Is there a special area I should park in and is my spot reserved?,Parking,,,,,,,
Can I have multiple upcoming reservations for the same car?,Parking,,,,,,,
What is the minimum length of stay required to prepay for parking?,Parking,,,,,,,
What is the maximum length of stay for prepaid parking?,Parking,,,,,,,
How can I extend my parking reservation?,Parking,,,,,,,
Give me parking charges about 2 wheelers.,Parking,,,,,,,
What are 2 wheeler parking charges.,Parking,,,,,,,
how to Pre book valet Parking service,Parking,,,,,,,
How do I pre book valet parking,Parking,,,,,,,
What are 4 wheeler parking charges.,Parking,,,,,,,
bus fare from rgia to jbs?,Bus,,,,,,,
bus fare from rgia to Secundrabad?,Bus,,,,,,,
bus fare from rgia to Secundrabad after ten in the evening?,Bus,,,,,,,
bus fare from jbs to rgia,Bus,,,,,,,
bus fare from jbs to secunderabad?,Bus,,,,,,,
bus fare from jbs to care hospitals?,Bus,,,,,,,
bus fare from jbs to nagole,Bus,,,,,,,
bus fare from rgia to miyapur,Bus,,,,,,,
bus fare from jbs to tarnaka,Bus,,,,,,,
bus fare from jbs to sangeeth,Bus,,,,,,,
bus route from rgia to jbs,Bus,,,,,,,
What is the bus fare from jbs to nagole,Bus,,,,,,,
What is the fare for bus from rgia to nagole,Bus,,,,,,,
what are the bus timings from rgia,Bus,,,,,,,
what route the bus takes for Balapur,Bus,,,,,,,
What is the route of the bus going to Balapur from RGIA ,Bus,,,,,,,
What is bus route from JBS to L.B.Nagar,Bus,,,,,,,
what are the bus departure timings from RGIA to JBS,Bus,,,,,,,
which is the next bus to nagole,Bus,,,,,,,
next bus to sangeeth,Bus,,,,,,,
what are the bus timings from jbs to rgia,Bus,,,,,,,
what are the bus timings for L.B.Nagar,Bus,,,,,,,
which bus takes to jbs and its timings,Bus,,,,,,,
Give me flight numbers of flights departing from Madras.,Flight,,,,,,,
Give me flight numbers of flights departing from MAA.,Flight,,,,,,,
Give me flight numbers of flights departing from MAA or DEL.,Flight,,,,,,,
When did flight with flight number 6E 464 land,Flight,,,,,,,
Give me the belt number for arriving flight no 6E 1314 ,Flight,,,,,,,
When does flight number 9I 871 leave?,Flight,,,,,,,
Give me details Flight numbers ariving from Delhi or Madras.,Flight,,,,,,,
Give me arrival details of flight no 6E 1314,Flight,,,,,,,
Give me details FLNO departing from Madras.,Flight,,,,,,,
Give me details FLNO ariving from DELHI and MAA.,Flight,,,,,,,
Give arrival details of 6E 464.,Flight,,,,,,,
Give STOA of 6E 464.,Flight,,,,,,,
"the flight number 9I 848 is arriving, give me belt  number  ",Flight,,,,,,,
"the flight number AI 544 is arriving, give me belt  number",Flight,,,,,,,
what is arrival time for flight 6E 2063  ,Flight,,,,,,,
what is the departure time for 6E 2063,Flight,,,,,,,
what is arrival time for 6E 626?  ,Flight,,,,,,,
what is the departure for flight 6E 626,Flight,,,,,,,
Is the flight QP 1418 on time ,Flight,,,,,,,
Is flight QP 1418 late?,Flight,,,,,,,
